{
  "cdts_version": "0.1",
  "trace_id": "cdts-absence-001",
  "trace_revision": 1,
  "trace_scope": {
    "scope_id": "scope-absence-001",
    "correlation_subject": "municipal-notification-operation",
    "summary": "Records correlated around a bounded infrastructure operation.",
    "observed_from": "2026-01-01T00:00:00Z",
    "observed_to": "2026-01-01T00:10:00Z",
    "scope_status": "correlation_scope"
  },
  "source_revisions": [
    {
      "owner": "MPAA",
      "repository": "https://github.com/gv1983us-commits/mpaa",
      "revision": "0d1aaf35cc4826622f3312fdd2a1c2d40890b965",
      "role": "normative_source"
    },
    {
      "owner": "BEC",
      "repository": "https://github.com/gv1983us-commits/behavioral-execution-contract",
      "revision": "62f2b7940b5ca7a4a8b24150b9c45a6ab5d97261",
      "role": "normative_source"
    },
    {
      "owner": "REVIEW_PROTOCOL",
      "repository": "https://github.com/gv1983us-commits/repository-canon-review-protocol",
      "revision": "b4205ffd91a6316ab40243cbf8161a1c512cae1f",
      "role": "source_policy"
    }
  ],
  "record_refs": [
    {
      "ref_id": "ref-mpaa-1",
      "owner": "MPAA",
      "specification_revision": "0d1aaf35cc4826622f3312fdd2a1c2d40890b965",
      "record_type": "runtime_report",
      "record_id": "owner-local-1",
      "location": "https://records.example.invalid/mpaa/owner-local-1",
      "digest": "sha256:aaaaaaaaaaaaaaaaaaaaaaaaaaaaaaaaaaaaaaaaaaaaaaaaaaaaaaaaaaaaaaaa",
      "recorded_at": "2026-01-01T00:04:00Z",
      "link_direction": "external_to_cdts",
      "non_import_boundary": "trace_reference_only",
      "conclusion_imported": false
    },
    {
      "ref_id": "ref-bec-1",
      "owner": "BEC",
      "specification_revision": "62f2b7940b5ca7a4a8b24150b9c45a6ab5d97261",
      "record_type": "execution_record",
      "record_id": "owner-local-1",
      "location": "https://records.example.invalid/bec/owner-local-1",
      "digest": "sha256:aaaaaaaaaaaaaaaaaaaaaaaaaaaaaaaaaaaaaaaaaaaaaaaaaaaaaaaaaaaaaaaa",
      "recorded_at": "2026-01-01T00:05:00Z",
      "link_direction": "external_to_cdts",
      "non_import_boundary": "trace_reference_only",
      "conclusion_imported": false
    }
  ],
  "absences": [
    {
      "absence_id": "absence-pca-1",
      "owner": "PCA",
      "record_type": "transition_record",
      "state": "not_applicable",
      "reason": "No process-continuity claim is in this correlation scope."
    }
  ],
  "linkage_assertions": [
    {
      "linkage_id": "link-1",
      "from_ref": "ref-mpaa-1",
      "to_ref": "ref-bec-1",
      "relationship": "cdts.correlates",
      "direction": "undirected",
      "basis": "cdts.explicit_reference",
      "evidence_refs": [],
      "assertion_status": "cdts.declared",
      "asserted_by": "urn:example:producer:trace-builder",
      "asserted_at": "2026-01-01T00:11:00Z"
    }
  ],
  "conflicts": [],
  "unresolved": [],
  "provenance": {
    "produced_by": "urn:example:producer:trace-builder",
    "produced_at": "2026-01-01T00:12:00Z",
    "producer_role": "coordination_layer",
    "notes": []
  },
  "amendments": []
}
